AIME 2000 I 1,"[2020-06, 10C, number-theory, construct]",N,10,"Find the least positive integer $n$ such that no matter how $10^{n}$ is expressed as the product of any two positive integers, at least one of these two integers contains the digit $0.$",https://artofproblemsolving.com/wiki/index.php/2000\_AIME\_I\_Problems/Problem\_1,8
AIME 2000 I 2,"[2020-06, 15C, geometry, area, coords]",G,15,"Let $u$ and $v$ be integers satisfying $0 < v < u$. Let $A = (u,v)$, let $B$ be the reflection of $A$ across the line $y = x$, let $C$ be the reflection of $B$ across the y-axis, let $D$ be the reflection of $C$ across the x-axis, and let $E$ be the reflection of $D$ across the y-axis. The area of pentagon $ABCDE$ is $451$. Find $u + v$.",https://artofproblemsolving.com/wiki/index.php/2000\_AIME\_I\_Problems/Problem\_2,21
AIME 2000 I 3,"[2020-06, 15C, algebra, manipulate]",A,15,"In the expansion of $(ax + b)^{2000},$ where $a$ and $b$ are relatively prime positive integers, the coefficients of $x^{2}$ and $x^{3}$ are equal. Find $a + b$.",https://artofproblemsolving.com/wiki/index.php/2000\_AIME\_I\_Problems/Problem\_3,667
AIME 2000 I 4,"[2020-06, 15C, geometry, algebra, construct, experiment]",G,15,"The diagram shows a rectangle that has been dissected into nine non-overlapping squares. Given that the width and the height of the rectangle are relatively prime positive integers, find the perimeter of the rectangle.

\begin{center}
\begin{asy}
draw((0,0)--(69,0)--(69,61)--(0,61)--(0,0)); draw((36,0)--(36,36)--(0,36)); draw((36,33)--(69,33)); draw((41,33)--(41,61)); draw((25,36)--(25,61)); draw((34,36)--(34,45)--(25,45)); draw((36,36)--(36,38)--(34,38)); draw((36,38)--(41,38)); draw((34,45)--(41,45)); 
\end{asy}
\end{center}",https://artofproblemsolving.com/wiki/index.php/2000\_AIME\_I\_Problems/Problem\_4,260
AIME 2000 I 5,"[2020-06, 15C, combo, algebra]",C,15,"Each of two boxes contains both black and white marbles, and the total number of marbles in the two boxes is $25.$ One marble is taken out of each box randomly. The probability that both marbles are black is $27/50,$ and the probability that both marbles are white is $m/n,$ where $m$ and $n$ are relatively prime positive integers. What is $m + n$?",https://artofproblemsolving.com/wiki/index.php/2000\_AIME\_I\_Problems/Problem\_5,26
AIME 2000 I 6,"[2020-06, 15C, algebra, manipulate]",A,15,"For how many ordered pairs $(x,y)$ of integers is it true that $0 < x < y < 10^6$ and that the arithmetic mean of $x$ and $y$ is exactly $2$ more than the geometric mean of $x$ and $y$?",https://artofproblemsolving.com/wiki/index.php/2000\_AIME\_I\_Problems/Problem\_6,997
AIME 2000 I 7,"[2020-06, 15C, algebra, manipulate, important]",A,15,"Suppose that $x,$ $y,$ and $z$ are three positive numbers that satisfy the equations $xyz = 1,$ $x + \frac {1}{z} = 5,$ and $y + \frac {1}{x} = 29.$ Then $z + \frac {1}{y} = \frac {m}{n},$ where $m$ and $n$ are relatively prime positive integers. Find $m + n$.",https://artofproblemsolving.com/wiki/index.php/2000\_AIME\_I\_Problems/Problem\_7,5
AIME 2000 I 8,"[2020-06, 20C, geometry, 3d-geo]",G,20,"A container in the shape of a right circular cone is $12$ inches tall and its base has a $5$-inch radius. The liquid that is sealed inside is $9$ inches deep when the cone is held with its point down and its base horizontal. When the liquid is held with its point up and its base horizontal, the height of the liquid is $m - n\sqrt [3]{p},$ from the base where $m,$ $n,$ and $p$ are positive integers and $p$ is not divisible by the cube of any prime number. Find $m + n + p$.",https://artofproblemsolving.com/wiki/index.php/2000\_AIME\_I\_Problems/Problem\_8,52
AIME 2000 I 9,"[2020-06, 20C, algebra, manipulate, logs]",A,20,"The system of equations
\begin{align*}
\log_{10}(2000xy) - (\log_{10}x)(\log_{10}y) & = 4 \\ \log_{10}(2yz) - (\log_{10}y)(\log_{10}z) & = 1 \\ \log_{10}(zx) - (\log_{10}z)(\log_{10}x) & = 0 \\ \end{align*}
has two solutions $(x_{1},y_{1},z_{1})$ and $(x_{2},y_{2},z_{2})$. Find $y_{1} + y_{2}$.",https://artofproblemsolving.com/wiki/index.php/2000\_AIME\_I\_Problems/Problem\_9,25
AIME 2000 I 10,"[2020-06, 20C, algebra, sequences]",A,20,"A sequence of numbers $x_{1},x_{2},x_{3},\ldots,x_{100}$ has the property that, for every integer $k$ between $1$ and $100,$ inclusive, the number $x_{k}$ is $k$ less than the sum of the other $99$ numbers. Given that $x_{50} = m/n,$ where $m$ and $n$ are relatively prime positive integers, find $m + n$.",https://artofproblemsolving.com/wiki/index.php/2000\_AIME\_I\_Problems/Problem\_10,173
AIME 2000 I 11,"[2020-06, 25C, number-theory,   , gen-func]",N,25,"Let $S$ be the sum of all numbers of the form $a/b,$ where $a$ and $b$ are relatively prime positive divisors of $1000.$ What is the greatest integer that does not exceed $S/10$?",https://artofproblemsolving.com/wiki/index.php/2000\_AIME\_I\_Problems/Problem\_11,248
AIME 2000 I 12,"[2020-06, 25C, algebra, experiment, construct]",A,25,"Given a function $f$ for which\[f(x) = f(398 - x) = f(2158 - x) = f(3214 - x)\]holds for all real $x,$ what is the largest number of different values that can appear in the list $f(0),f(1),f(2),\ldots,f(999)?$",https://artofproblemsolving.com/wiki/index.php/2000\_AIME\_I\_Problems/Problem\_12,177
AIME 2000 I 13,"[2020-06, 35C, geometry, optimize, coords, gimmick]",G,35,"In the middle of a vast prairie, a firetruck is stationed at the intersection of two perpendicular straight highways. The truck travels at $50$ miles per hour along the highways and at $14$ miles per hour across the prairie. Consider the set of points that can be reached by the firetruck within six minutes. The area of this region is $m/n$ square miles, where $m$ and $n$ are relatively prime positive integers. Find $m + n$.",https://artofproblemsolving.com/wiki/index.php/2000\_AIME\_I\_Problems/Problem\_13,731
AIME 2000 I 14,"[2020-06, 30C, geometry, lengths, angles]",G,30,"In triangle $ABC,$ it is given that angles $B$ and $C$ are congruent. Points $P$ and $Q$ lie on $\overline{AC}$ and $\overline{AB},$ respectively, so that $AP = PQ = QB = BC.$ Angle $ACB$ is $r$ times as large as angle $APQ,$ where $r$ is a positive real number. Find the greatest integer that does not exceed $1000r$.",https://artofproblemsolving.com/wiki/index.php/2000\_AIME\_I\_Problems/Problem\_14,571
AIME 2000 I 15,"[2020-06, 35C, combo, experiment, courage]",C,35,"A stack of $2000$ cards is labelled with the integers from $1$ to $2000,$ with different integers on different cards. The cards in the stack are not in numerical order. The top card is removed from the stack and placed on the table, and the next card is moved to the bottom of the stack. The new top card is removed from the stack and placed on the table, to the right of the card already there, and the next card in the stack is moved to the bottom of the stack. The process - placing the top card to the right of the cards already on the table and moving the next card in the stack to the bottom of the stack - is repeated until all cards are on the table. It is found that, reading from left to right, the labels on the cards are now in ascending order: $1,2,3,\ldots,1999,2000.$ In the original stack of cards, how many cards were above the card labeled $1999$?",https://artofproblemsolving.com/wiki/index.php/2000\_AIME\_I\_Problems/Problem\_15,927
AIME 2000 II 1,"[2020-06, 10C, algebra, logs]",A,10,"The number
$\frac 2{\log_4{2000^6}} + \frac 3{\log_5{2000^6}}$
can be written as $\frac mn$ where $m$ and $n$ are relatively prime positive integers. Find $m + n$.",https://artofproblemsolving.com/wiki/index.php/2000\_AIME\_II\_Problems/Problem\_1,7
AIME 2000 II 2,"[2020-06, 5C, algebra, manipulate]",A,5,A point whose coordinates are both integers is called a lattice point. How many lattice points lie on the hyperbola $x^2 - y^2 = 2000^2$?,https://artofproblemsolving.com/wiki/index.php/2000\_AIME\_II\_Problems/Problem\_2,98
AIME 2000 II 3,"[2020-06, 15C, combo]",C,15,"A deck of forty cards consists of four $1$'s, four $2$'s,..., and four $10$'s. A matching pair (two cards with the same number) is removed from the deck. Given that these cards are not returned to the deck, let $m/n$ be the probability that two randomly selected cards also form a pair, where $m$ and $n$ are relatively prime positive integers. Find $m + n.$",https://artofproblemsolving.com/wiki/index.php/2000\_AIME\_II\_Problems/Problem\_3,758
AIME 2000 II 4,"[2020-06, 15C, number-theory, factors]",N,15,What is the smallest positive integer with six positive odd integer divisors and twelve positive even integer divisors?,https://artofproblemsolving.com/wiki/index.php/2000\_AIME\_II\_Problems/Problem\_4,180
AIME 2000 II 5,"[2020-06, 20C, combo]",C,20,"Given eight distinguishable rings, let $n$ be the number of possible five-ring arrangements on the four fingers (not the thumb) of one hand. The order of rings on each finger is significant, but it is not required that each finger have a ring. Find the leftmost three nonzero digits of $n$.",https://artofproblemsolving.com/wiki/index.php/2000\_AIME\_II\_Problems/Problem\_5,376
AIME 2000 II 6,"[2020-06, 20C, geometry, lengths]",G,20,One base of a trapezoid is $100$ units longer than the other base. The segment that joins the midpoints of the legs divides the trapezoid into two regions whose areas are in the ratio $2: 3$. Let $x$ be the length of the segment joining the legs of the trapezoid that is parallel to the bases and that divides the trapezoid into two regions of equal area. Find the greatest integer that does not exceed $x^2/100$.,https://artofproblemsolving.com/wiki/index.php/2000\_AIME\_II\_Problems/Problem\_6,181
AIME 2000 II 7,"[2020-06, 15C, algebra, manipulate]",A,15,"Given that

\[\frac 1{2!17!}+\frac 1{3!16!}+\frac 1{4!15!}+\frac 1{5!14!}+\frac 1{6!13!}+\frac 1{7!12!}+\frac 1{8!11!}+\frac 1{9!10!}=\frac N{1!18!}\]
find the greatest integer that is less than $\frac N{100}$.",https://artofproblemsolving.com/wiki/index.php/2000\_AIME\_II\_Problems/Problem\_7,137
AIME 2000 II 8,"[2020-06, 20C, geometry, lengths]",G,20,"In trapezoid $ABCD$, leg $\overline{BC}$ is perpendicular to bases $\overline{AB}$ and $\overline{CD}$, and diagonals $\overline{AC}$ and $\overline{BD}$ are perpendicular. Given that $AB=\sqrt{11}$ and $AD=\sqrt{1001}$, find $BC^2$.",https://artofproblemsolving.com/wiki/index.php/2000\_AIME\_II\_Problems/Problem\_8,110
AIME 2000 II 9,"[2020-06, 25C, algebra, complex, trig]",A,25,"Given that $z$ is a complex number such that $z+\frac 1z=2\cos 3^\circ$, find the least integer that is greater than $z^{2000}+\frac 1{z^{2000}}$.",https://artofproblemsolving.com/wiki/index.php/2000\_AIME\_II\_Problems/Problem\_9,0
AIME 2000 II 10,"[2020-06, 25C, geometry, lengths]",G,25,"A circle is inscribed in quadrilateral $ABCD$, tangent to $\overline{AB}$ at $P$ and to $\overline{CD}$ at $Q$. Given that $AP=19$, $PB=26$, $CQ=37$, and $QD=23$, find the square of the radius of the circle.",https://artofproblemsolving.com/wiki/index.php/2000\_AIME\_II\_Problems/Problem\_10,647
AIME 2000 II 11,"[2020-06, 30C, algebra, geometry, coords]",A,30,"The coordinates of the vertices of isosceles trapezoid $ABCD$ are all integers, with $A=(20,100)$ and $D=(21,107)$. The trapezoid has no horizontal or vertical sides, and $\overline{AB}$ and $\overline{CD}$ are the only parallel sides. The sum of the absolute values of all possible slopes for $\overline{AB}$ is $m/n$, where $m$ and $n$ are relatively prime positive integers. Find $m+n$.",https://artofproblemsolving.com/wiki/index.php/2000\_AIME\_II\_Problems/Problem\_11,131
AIME 2000 II 12,"[2020-06, 25C, geometry, lengths, 3d-geo, coords]",G,25,"The points $A$, $B$ and $C$ lie on the surface of a sphere with center $O$ and radius $20$. It is given that $AB=13$, $BC=14$, $CA=15$, and that the distance from $O$ to $\triangle ABC$ is $\frac{m\sqrt{n}}k$, where $m$, $n$, and $k$ are positive integers, $m$ and $k$ are relatively prime, and $n$ is not divisible by the square of any prime. Find $m+n+k$.",https://artofproblemsolving.com/wiki/index.php/2000\_AIME\_II\_Problems/Problem\_12,118
AIME 2000 II 13,"[2020-06, 25C, algebra, polynomial]",A,25,"The equation $2000x^6+100x^5+10x^3+x-2=0$ has exactly two real roots, one of which is $\frac{m+\sqrt{n}}r$, where $m$, $n$ and $r$ are integers, $m$ and $r$ are relatively prime, and $r>0$. Find $m+n+r$.",https://artofproblemsolving.com/wiki/index.php/2000\_AIME\_II\_Problems/Problem\_13,200
AIME 2000 II 14,"[2020-06, 35C, combo, number-theory, experiment]",C,35,"Every positive integer $k$ has a unique factorial base expansion $(f_1,f_2,f_3,\ldots,f_m)$, meaning that $k=1!\cdot f_1+2!\cdot f_2+3!\cdot f_3+\cdots+m!\cdot f_m$, where each $f_i$ is an integer, $0\le f_i\le i$, and $0<f_m$. Given that $(f_1,f_2,f_3,\ldots,f_j)$ is the factorial base expansion of $16!-32!+48!-64!+\cdots+1968!-1984!+2000!$, find the value of $f_1-f_2+f_3-f_4+\cdots+(-1)^{j+1}f_j$.",https://artofproblemsolving.com/wiki/index.php/2000\_AIME\_II\_Problems/Problem\_14,495
AIME 2000 II 15,"[2020-06, 25C, algebra, trig, manipulate]",A,25,"Find the least positive integer $n$ such that

$\frac 1{\sin 45^\circ\sin 46^\circ}+\frac 1{\sin 47^\circ\sin 48^\circ}+\cdots+\frac 1{\sin 133^\circ\sin 134^\circ}=\frac 1{\sin n^\circ}.$",https://artofproblemsolving.com/wiki/index.php/2000\_AIME\_II\_Problems/Problem\_15,1
AIME 2001 I 1,"[2020-06, 0C, algebra]",A,0,Find the sum of all positive two-digit integers that are divisible by each of their digits.,https://artofproblemsolving.com/wiki/index.php/2001\_AIME\_I\_Problems/Problem\_1,630
AIME 2001 I 2,"[2020-06, 5C, algebra]",A,5,"A finite set $\mathcal{S}$ of distinct real numbers has the following properties: the mean of $\mathcal{S}\cup\{1\}$ is $13$ less than the mean of $\mathcal{S}$, and the mean of $\mathcal{S}\cup\{2001\}$ is $27$ more than the mean of $\mathcal{S}$. Find the mean of $\mathcal{S}$.",https://artofproblemsolving.com/wiki/index.php/2001\_AIME\_I\_Problems/Problem\_2,651
AIME 2001 I 3,"[2020-06, 10C, algebra, polynomial]",A,10,"Find the sum of the roots, real and non-real, of the equation $x^{2001}+\left(\frac 12-x\right)^{2001}=0$, given that there are no multiple roots.",https://artofproblemsolving.com/wiki/index.php/2001\_AIME\_I\_Problems/Problem\_3,500
AIME 2001 I 4,"[2020-06, 15C, geometry, lengths]",G,15,"In triangle $ABC$, angles $A$ and $B$ measure $60$ degrees and $45$ degrees, respectively. The bisector of angle $A$ intersects $\overline{BC}$ at $T$, and $AT=24$. The area of triangle $ABC$ can be written in the form $a+b\sqrt{c}$, where $a$, $b$, and $c$ are positive integers, and $c$ is not divisible by the square of any prime. Find $a+b+c$.",https://artofproblemsolving.com/wiki/index.php/2001\_AIME\_I\_Problems/Problem\_4,291
AIME 2001 I 5,"[2020-06, 25C, geometry, coords, ellipse]",G,25,"An equilateral triangle is inscribed in the ellipse whose equation is $x^2+4y^2=4$. One vertex of the triangle is $(0,1)$, one altitude is contained in the y-axis, and the length of each side is $\sqrt{\frac mn}$, where $m$ and $n$ are relatively prime positive integers. Find $m+n$.",https://artofproblemsolving.com/wiki/index.php/2001\_AIME\_I\_Problems/Problem\_5,937
AIME 2001 I 6,"[2020-06, 15C, combo, biject]",C,15,A fair die is rolled four times. The probability that each of the final three rolls is at least as large as the roll preceding it may be expressed in the form $\frac{m}{n}$ where $m$ and $n$ are relatively prime positive integers. Find $m + n$.,https://artofproblemsolving.com/wiki/index.php/2001\_AIME\_I\_Problems/Problem\_6,79
AIME 2001 I 7,"[2020-06, 25C, geometry, config-geo, lengths]",G,25,"Triangle $ABC$ has $AB=21$, $AC=22$ and $BC=20$. Points $D$ and $E$ are located on $\overline{AB}$ and $\overline{AC}$, respectively, such that $\overline{DE}$ is parallel to $\overline{BC}$ and contains the center of the inscribed circle of triangle $ABC$. Then $DE=m/n$, where $m$ and $n$ are relatively prime positive integers. Find $m+n$.",https://artofproblemsolving.com/wiki/index.php/2001\_AIME\_I\_Problems/Problem\_7,923
AIME 2001 I 8,"[2020-06, 20C, number-theory, algebra]",N,20,"Call a positive integer $N$ a \emph{7-10 double} if the digits of the base-$7$ representation of $N$ form a base-$10$ number that is twice $N$. For example, $51$ is a 7-10 double because its base-$7$ representation is $102$. What is the largest 7-10 double?",https://artofproblemsolving.com/wiki/index.php/2001\_AIME\_I\_Problems/Problem\_8,315
AIME 2001 I 9,"[2020-06, 25C, algebra, geometry, legnths, area]",A,25,"In triangle $ABC$, $AB=13$, $BC=15$ and $CA=17$. Point $D$ is on $\overline{AB}$, $E$ is on $\overline{BC}$, and $F$ is on $\overline{CA}$. Let $AD=p\cdot AB$, $BE=q\cdot BC$, and $CF=r\cdot CA$, where $p$, $q$, and $r$ are positive and satisfy $p+q+r=2/3$ and $p^2+q^2+r^2=2/5$. The ratio of the area of triangle $DEF$ to the area of triangle $ABC$ can be written in the form $m/n$, where $m$ and $n$ are relatively prime positive integers. Find $m+n$.",https://artofproblemsolving.com/wiki/index.php/2001\_AIME\_I\_Problems/Problem\_9,61
AIME 2001 I 10,"[2020-06, 15C, combo, cases]",C,15,"Let $S$ be the set of points whose coordinates $x,$ $y,$ and $z$ are integers that satisfy $0\le x\le2,$ $0\le y\le3,$ and $0\le z\le4.$ Two distinct points are randomly chosen from $S.$ The probability that the midpoint of the segment they determine also belongs to $S$ is $m/n,$ where $m$ and $n$ are relatively prime positive integers. Find $m + n.$",https://artofproblemsolving.com/wiki/index.php/2001\_AIME\_I\_Problems/Problem\_10,200
AIME 2001 I 11,"[2020-06, 25C, number-theory, experiment, courage]",N,25,"In a rectangular array of points, with 5 rows and $N$ columns, the points are numbered consecutively from left to right beginning with the top row. Thus the top row is numbered 1 through $N,$ the second row is numbered $N + 1$ through $2N,$ and so forth. Five points, $P_1, P_2, P_3, P_4,$ and $P_5,$ are selected so that each $P_i$ is in row $i.$ Let $x_i$ be the number associated with $P_i.$ Now renumber the array consecutively from top to bottom, beginning with the first column. Let $y_i$ be the number associated with $P_i$ after the renumbering. It is found that $x_1 = y_2,$ $x_2 = y_1,$ $x_3 = y_4,$ $x_4 = y_5,$ and $x_5 = y_3.$ Find the smallest possible value of $N.$",https://artofproblemsolving.com/wiki/index.php/2001\_AIME\_I\_Problems/Problem\_11,149
AIME 2001 I 12,"[2020-06, 20C, geometry, coords, 3d-geo]",G,20,"A sphere is inscribed in the tetrahedron whose vertices are $A = (6,0,0), B = (0,4,0), C = (0,0,2),$ and $D = (0,0,0).$ The radius of the sphere is $m/n,$ where $m$ and $n$ are relatively prime positive integers. Find $m + n.$",https://artofproblemsolving.com/wiki/index.php/2001\_AIME\_I\_Problems/Problem\_12,5
AIME 2001 I 13,"[2020-06, 20C, geometry, algebra, lengths]",G,20,"In a certain circle, the chord of a $d$-degree arc is $22$ centimeters long, and the chord of a $2d$-degree arc is $20$ centimeters longer than the chord of a $3d$-degree arc, where $d < 120.$ The length of the chord of a $3d$-degree arc is $- m + \sqrt {n}$ centimeters, where $m$ and $n$ are positive integers. Find $m + n.$",https://artofproblemsolving.com/wiki/index.php/2001\_AIME\_I\_Problems/Problem\_13,174
AIME 2001 I 14,"[2020-06, 30C, combo, recur, cases, important]",C,30,"A mail carrier delivers mail to the nineteen houses on the east side of Elm Street. The carrier notices that no two adjacent houses ever get mail on the same day, but that there are never more than two houses in a row that get no mail on the same day. How many different patterns of mail delivery are possible?",https://artofproblemsolving.com/wiki/index.php/2001\_AIME\_I\_Problems/Problem\_14,351
AIME 2001 I 15,"[2020-06, 35C, combo, careful, cases]",C,35,"The numbers $1, 2, 3, 4, 5, 6, 7,$ and $8$ are randomly written on the faces of a regular octahedron so that each face contains a different number. The probability that no two consecutive numbers, where $8$ and $1$ are considered to be consecutive, are written on faces that share an edge is $m/n,$ where $m$ and $n$ are relatively prime positive integers. Find $m + n.$",https://artofproblemsolving.com/wiki/index.php/2001\_AIME\_I\_Problems/Problem\_15,85
AIME 2001 II 1,"[2020-06, 10C, number-theory, experiment]",N,10,"Let $N$ be the largest positive integer with the following property: reading from left to right, each pair of consecutive digits of $N$ forms a perfect square. What are the leftmost three digits of $N$?",https://artofproblemsolving.com/wiki/index.php/2001\_AIME\_II\_Problems/Problem\_1,816
AIME 2001 II 2,"[2020-06, 10C, combo]",C,10,"Each of the $2001$ students at a high school studies either Spanish or French, and some study both. The number who study Spanish is between $80$ percent and $85$ percent of the school population, and the number who study French is between $30$ percent and $40$ percent. Let $m$ be the smallest number of students who could study both languages, and let $M$ be the largest number of students who could study both languages. Find $M-m$.",https://artofproblemsolving.com/wiki/index.php/2001\_AIME\_II\_Problems/Problem\_2,298
AIME 2001 II 3,"[2020-06, 15C, algebra, manipulate]",A,15,"Given that

\begin{align*}x_{1}&=211,\\ x_{2}&=375,\\ x_{3}&=420,\\ x_{4}&=523,\ \text{and}\\ x_{n}&=x_{n-1}-x_{n-2}+x_{n-3}-x_{n-4}\ \text{when}\ n\geq5, \end{align*}
find the value of $x_{531}+x_{753}+x_{975}$.",https://artofproblemsolving.com/wiki/index.php/2001\_AIME\_II\_Problems/Problem\_3,898
AIME 2001 II 4,"[2020-06, 5C, geometry, coords]",G,5,"Let $R = (8,6)$. The lines whose equations are $8y = 15x$ and $10y = 3x$ contain points $P$ and $Q$, respectively, such that $R$ is the midpoint of $\overline{PQ}$. The length of $PQ$ equals $\frac {m}{n}$, where $m$ and $n$ are relatively prime positive integers. Find $m + n$.",https://artofproblemsolving.com/wiki/index.php/2001\_AIME\_II\_Problems/Problem\_4,67
AIME 2001 II 5,"[2020-06, 20C, combo, experiment, construct]",C,20,"A set of positive numbers has the triangle property if it has three distinct elements that are the lengths of the sides of a triangle whose area is positive. Consider sets $\{4, 5, 6, \ldots, n\}$ of consecutive positive integers, all of whose ten-element subsets have the triangle property. What is the largest possible value of $n$?",https://artofproblemsolving.com/wiki/index.php/2001\_AIME\_II\_Problems/Problem\_5,253
AIME 2001 II 6,"[2020-06, 15C, geometry, lengths]",G,15,Square $ABCD$ is inscribed in a circle. Square $EFGH$ has vertices $E$ and $F$ on $\overline{CD}$ and vertices $G$ and $H$ on the circle. The ratio of the area of square $EFGH$ to the area of square $ABCD$ can be expressed as $\frac {m}{n}$ where $m$ and $n$ are relatively prime positive integers and $m < n$. Find $10n + m$.,https://artofproblemsolving.com/wiki/index.php/2001\_AIME\_II\_Problems/Problem\_6,251
AIME 2001 II 7,"[2020-06, 25C, geometry, lengths, coords]",G,25,"Let $\triangle{PQR}$ be a right triangle with $PQ = 90$, $PR = 120$, and $QR = 150$. Let $C_{1}$ be the inscribed circle. Construct $\overline{ST}$ with $S$ on $\overline{PR}$ and $T$ on $\overline{QR}$, such that $\overline{ST}$ is perpendicular to $\overline{PR}$ and tangent to $C_{1}$. Construct $\overline{UV}$ with $U$ on $\overline{PQ}$ and $V$ on $\overline{QR}$ such that $\overline{UV}$ is perpendicular to $\overline{PQ}$ and tangent to $C_{1}$. Let $C_{2}$ be the inscribed circle of $\triangle{RST}$ and $C_{3}$ the inscribed circle of $\triangle{QUV}$. The distance between the centers of $C_{2}$ and $C_{3}$ can be written as $\sqrt {10n}$. What is $n$?",https://artofproblemsolving.com/wiki/index.php/2001\_AIME\_II\_Problems/Problem\_7,725
AIME 2001 II 8,"[2020-06, 20C, algebra, courage]",A,20,"A certain function $f$ has the properties that $f(3x) = 3f(x)$ for all positive real values of $x$, and that $f(x) = 1-|x-2|$ for $1\le x \le 3$. Find the smallest $x$ for which $f(x) = f(2001)$.",https://artofproblemsolving.com/wiki/index.php/2001\_AIME\_II\_Problems/Problem\_8,429
AIME 2001 II 9,"[2020-06, 20C, combo, cases, careful]",C,20,"Each unit square of a 3-by-3 unit-square grid is to be colored either blue or red. For each square, either color is equally likely to be used. The probability of obtaining a grid that does not have a 2-by-2 red square is $\frac {m}{n}$, where $m$ and $n$ are relatively prime positive integers. Find $m + n$.",https://artofproblemsolving.com/wiki/index.php/2001\_AIME\_II\_Problems/Problem\_9,929
AIME 2001 II 10,"[2020-06, 25C, number-theory, manipulate, modular]",N,25,"How many positive integer multiples of $1001$ can be expressed in the form $10^{j} - 10^{i}$, where $i$ and $j$ are integers and $0\leq i < j \leq 99$?",https://artofproblemsolving.com/wiki/index.php/2001\_AIME\_II\_Problems/Problem\_10,784
AIME 2001 II 11,"[2020-06, 15C, combo]",C,15,"Club Truncator is in a soccer league with six other teams, each of which it plays once. In any of its 6 matches, the probabilities that Club Truncator will win, lose, or tie are each $\frac {1}{3}$. The probability that Club Truncator will finish the season with more wins than losses is $\frac {m}{n}$, where $m$ and $n$ are relatively prime positive integers. Find $m + n$.",https://artofproblemsolving.com/wiki/index.php/2001\_AIME\_II\_Problems/Problem\_11,341
